{
  "id": "story-a1-transport-001",
  "band": "A",
  "level": 1,
  "bandLabel": "A1",
  "title": "坐車去夜市",
  "body": "今天晚上我坐車去夜市，買了一點吃的，喝了水，看到很多人。大家都很開心。",
  "vocabRefs": ["A1-0009", "A1-0007", "A1-0006"],
  "cultureRefs": ["https://www.moc.gov.tw/en/"],
  "audioUrl": "/audio/zh-TW/story-a1-transport-001.mp3"
}

